{
  "schema_version": 1,
  "subject_id": "incomplete-subject",
  "version": "v0.1.0",
  "status": "incomplete",
  "artifact": {
    "path": "../../../cmd/fixture-subject/main.go",
    "digest": "sha256:38b9e0e5a03b973da837856ccc25f939b6ed1e76d87ebc2a226d7edb8b5d6294",
    "media_type": "text/x-go"
  },
  "launch": { "driver": "go-source", "args": ["-role", "sink"], "port": 8080 },
  "interfaces": ["http-json-v1"],
  "certificate": "completion-certificate.json"
}
